{"format":"chorprobe/v1","title":"Lobet, ihr Himmel, Gott den Herrn, SWV 253","subtitle":"SATB · CPDL #46658","composer":"Heinrich Schütz · Text: Cornelius Becker · Ausgabe: James Gibb","tempo":80,"ppq":480,"source":{"description":"Automatisch umgewandelt aus der MusicXML-Datei „Psalm_148_Becker_Schutz.mxl“ der CPDL-Seite „Lobet, ihr Himmel, Gott den Herrn, SWV 253 (Heinrich Schütz)“ mit tools/liedquellen/cpdl_import.py. Nicht gegen die Vorlage geprüft. Hinweis der Ausgabe: Transcribed from the Blankenburg edition on IMSLP.","copyright":"Ausgabe: © James Gibb, Choral Public Domain Library (CPDL #46658, https://www.cpdl.org/wiki/index.php/Lobet%2C_ihr_Himmel%2C_Gott_den_Herrn%2C_SWV_253_%28Heinrich_Sch%C3%BCtz%29). Lizenz: CPDL-Lizenz (ChoralWiki Public Domain License, https://www.cpdl.org/wiki/index.php/ChoralWiki:CPDL). Geändert am 2026-10-04: in das Format chorprobe/v1 umgewandelt (Chorprobe-Import). Diese Datei darf unter denselben Bedingungen weitergegeben werden.","edition":"Ausgabe James Gibb (2017-10-07), CPDL #46658."},"voices":[{"id":"s1","name":"Sopran I","short":"S1","clef":"treble"},{"id":"s2","name":"Sopran II","short":"S2","clef":"treble"},{"id":"t1","name":"Tenor I","short":"T1","clef":"bass"},{"id":"t2","name":"Tenor II","short":"T2","clef":"bass"}],"sections":[{"id":"lied","name":"Lied"}],"measures":[{"id":"m1","number":"1","section":"lied","meter":[2,2],"keyFifths":0,"voices":{"s1":[{"at":0,"duration":960,"pitch":"D5","lyric":"Lo-"},{"at":960,"duration":480,"pitch":"G4","lyric":"bet,"},{"at":1440,"duration":480,"pitch":"D5","lyric":"ihr"}],"s2":[{"at":0,"duration":960,"pitch":"D4","lyric":"Lo-"},{"at":960,"duration":480,"pitch":"E4","lyric":"bet,"},{"at":1440,"duration":480,"pitch":"D4","lyric":"ihr"}],"t1":[{"at":0,"duration":960,"pitch":"B3","lyric":"Lo-"},{"at":960,"duration":480,"pitch":"B3","lyric":"bet,"},{"at":1440,"duration":480,"pitch":"G3","lyric":"ihr"}],"t2":[{"at":0,"duration":960,"pitch":"G3","lyric":"Lo-"},{"at":960,"duration":480,"pitch":"E3","lyric":"bet,"},{"at":1440,"duration":480,"pitch":"B2","lyric":"ihr"}]}},{"id":"m2","number":"2","section":"lied","meter":[2,2],"keyFifths":0,"voices":{"s1":[{"at":0,"duration":480,"pitch":"E5","lyric":"Him-"},{"at":480,"duration":480,"pitch":"D5","lyric":"mel,"},{"at":960,"duration":480,"pitch":"C5","lyric":"Gott"},{"at":1440,"duration":480,"pitch":"B4","lyric":"den"}],"s2":[{"at":0,"duration":480,"pitch":"C4","lyric":"Him-"},{"at":480,"duration":480,"pitch":"G4","lyric":"mel,"},{"at":960,"duration":480,"pitch":"E4","lyric":"Gott"},{"at":1440,"duration":480,"pitch":"E4","lyric":"den"}],"t1":[{"at":0,"duration":480,"pitch":"G3","lyric":"Him-"},{"at":480,"duration":480,"pitch":"B3","lyric":"mel,"},{"at":960,"duration":480,"pitch":"A3","lyric":"Gott"},{"at":1440,"duration":480,"pitch":"G#3","lyric":"den"}],"t2":[{"at":0,"duration":480,"pitch":"C3","lyric":"Him-"},{"at":480,"duration":480,"pitch":"G2","lyric":"mel,"},{"at":960,"duration":480,"pitch":"A2","lyric":"Gott"},{"at":1440,"duration":480,"pitch":"E3","lyric":"den"}]}},{"id":"m3","number":"3","section":"lied","meter":[2,2],"keyFifths":0,"voices":{"s1":[{"at":0,"duration":960,"pitch":"A4","lyric":"Herrn,"},{"at":960,"duration":960,"pitch":"E4","lyric":"sein"}],"s2":[{"at":0,"duration":960,"pitch":"E4","lyric":"Herrn,"},{"at":960,"duration":960,"pitch":"C4","lyric":"sein"}],"t1":[{"at":0,"duration":960,"pitch":"A3","lyric":"Herrn,"},{"at":960,"duration":960,"pitch":"A3","lyric":"sein"}],"t2":[{"at":0,"duration":960,"pitch":"A2","lyric":"Herrn,"},{"at":960,"duration":960,"pitch":"A3","lyric":"sein"}]}},{"id":"m4","number":"4","section":"lied","meter":[2,2],"keyFifths":0,"voices":{"s1":[{"at":0,"duration":480,"pitch":"A4","lyric":"wer-"},{"at":480,"duration":480,"pitch":"C5","lyric":"ten"},{"at":960,"duration":480,"pitch":"B4","lyric":"Na-"},{"at":1440,"duration":480,"pitch":"C5","lyric":"men"}],"s2":[{"at":0,"duration":480,"pitch":"E4","lyric":"wer-"},{"at":480,"duration":480,"pitch":"E4","lyric":"ten"},{"at":960,"duration":480,"pitch":"E4","lyric":"Na-"},{"at":1440,"duration":480,"pitch":"E4","lyric":"men"}],"t1":[{"at":0,"duration":480,"pitch":"C4","lyric":"wer-"},{"at":480,"duration":480,"pitch":"A3","lyric":"ten"},{"at":960,"duration":480,"pitch":"G#3","lyric":"Na-"},{"at":1440,"duration":480,"pitch":"A3","lyric":"men"}],"t2":[{"at":0,"duration":480,"pitch":"A3","lyric":"wer-"},{"at":480,"duration":480,"pitch":"A3","lyric":"ten"},{"at":960,"duration":480,"pitch":"E3","lyric":"Na-"},{"at":1440,"duration":480,"pitch":"A3","lyric":"men"}]}},{"id":"m5","number":"5","section":"lied","meter":[2,2],"keyFifths":0,"voices":{"s1":[{"at":0,"duration":480,"pitch":"D5","lyric":"sollt"},{"at":480,"duration":480,"pitch":"E5","lyric":"ihr"},{"at":960,"duration":960,"pitch":"C5","lyric":"ehr'n,"}],"s2":[{"at":0,"duration":480,"pitch":"G4","lyric":"sollt"},{"at":480,"duration":480,"pitch":"G4","lyric":"ihr"},{"at":960,"duration":960,"pitch":"F4","lyric":"ehr'n,"}],"t1":[{"at":0,"duration":480,"pitch":"B3","lyric":"sollt"},{"at":480,"duration":480,"pitch":"C4","lyric":"ihr"},{"at":960,"duration":960,"pitch":"A3","lyric":"ehr'n,"}],"t2":[{"at":0,"duration":480,"pitch":"G3","lyric":"sollt"},{"at":480,"duration":480,"pitch":"C3","lyric":"ihr"},{"at":960,"duration":960,"pitch":"F3","lyric":"ehr'n,"}]}},{"id":"m6","number":"6","section":"lied","meter":[2,2],"keyFifths":0,"voices":{"s1":[{"at":0,"duration":960,"pitch":"E5","lyric":"all"},{"at":960,"duration":480,"pitch":"D5","lyric":"sei-"},{"at":1440,"duration":480,"pitch":"B4","lyric":"ne"}],"s2":[{"at":0,"duration":960,"pitch":"G4","lyric":"all"},{"at":960,"duration":480,"pitch":"G4","lyric":"sei-"},{"at":1440,"duration":480,"pitch":"D4","lyric":"ne"}],"t1":[{"at":0,"duration":960,"pitch":"C4","lyric":"all"},{"at":960,"duration":480,"pitch":"B3","lyric":"sei-"},{"at":1440,"duration":480,"pitch":"G3","lyric":"ne"}],"t2":[{"at":0,"duration":960,"pitch":"C3","lyric":"all"},{"at":960,"duration":480,"pitch":"G3","lyric":"sei-"},{"at":1440,"duration":480,"pitch":"G3","lyric":"ne"}]}},{"id":"m7","number":"7","section":"lied","meter":[2,2],"keyFifths":0,"voices":{"s1":[{"at":0,"duration":480,"pitch":"D5","lyric":"En-"},{"at":480,"duration":480,"pitch":"A4","lyric":"gel,"},{"at":960,"duration":480,"pitch":"C5","lyric":"lobt"},{"at":1440,"duration":480,"pitch":"B4","lyric":"ihn"}],"s2":[{"at":0,"duration":480,"pitch":"F4","lyric":"En-"},{"at":480,"duration":480,"pitch":"C4","lyric":"gel,"},{"at":960,"duration":480,"pitch":"E4","lyric":"lobt"},{"at":1440,"duration":480,"pitch":"D4","lyric":"ihn"}],"t1":[{"at":0,"duration":480,"pitch":"A3","lyric":"En-"},{"at":480,"duration":480,"pitch":"A3","lyric":"gel,"},{"at":960,"duration":480,"pitch":"G3","lyric":"lobt"},{"at":1440,"duration":480,"pitch":"G3","lyric":"ihn"}],"t2":[{"at":0,"duration":480,"pitch":"D3","lyric":"En-"},{"at":480,"duration":480,"pitch":"F3","lyric":"gel,"},{"at":960,"duration":480,"pitch":"C3","lyric":"lobt"},{"at":1440,"duration":480,"pitch":"G2","lyric":"ihn"}]}},{"id":"m8","number":"8","section":"lied","meter":[2,2],"keyFifths":0,"voices":{"s1":[{"at":0,"duration":960,"pitch":"A4","lyric":"sehr,"},{"at":960,"duration":960,"pitch":"D4","lyric":"zu-"}],"s2":[{"at":0,"duration":960,"pitch":"D4","lyric":"sehr,"},{"at":960,"duration":960,"pitch":"F4","lyric":"zu-"}],"t1":[{"at":0,"duration":960,"pitch":"F#3","lyric":"sehr,"},{"at":960,"duration":960,"pitch":"A3","lyric":"zu-"}],"t2":[{"at":0,"duration":960,"pitch":"D3","lyric":"sehr,"},{"at":960,"duration":960,"pitch":"D3","lyric":"zu-"}]}},{"id":"m9","number":"9","section":"lied","meter":[2,2],"keyFifths":0,"voices":{"s1":[{"at":0,"duration":480,"pitch":"G4","lyric":"samt"},{"at":480,"duration":480,"pitch":"A4","lyric":"dem"},{"at":960,"duration":360,"pitch":"B4","lyric":"him-"},{"at":1320,"duration":120,"pitch":"C5"},{"at":1440,"duration":240,"pitch":"D5"},{"at":1680,"duration":240,"pitch":"C5","lyric":"me-"}],"s2":[{"at":0,"duration":480,"pitch":"E4","lyric":"samt"},{"at":480,"duration":480,"pitch":"F#4","lyric":"dem"},{"at":960,"duration":720,"pitch":"G4","lyric":"him-"},{"at":1680,"duration":240,"pitch":"E4","lyric":"me-"}],"t1":[{"at":0,"duration":480,"pitch":"C4","lyric":"samt"},{"at":480,"duration":480,"pitch":"C4","lyric":"dem"},{"at":960,"duration":360,"pitch":"D4","lyric":"him-"},{"at":1320,"duration":120,"pitch":"C4"},{"at":1440,"duration":240,"pitch":"B3"},{"at":1680,"duration":240,"pitch":"A3","tie":true,"lyric":"me-"}],"t2":[{"at":0,"duration":480,"pitch":"C3","lyric":"samt"},{"at":480,"duration":480,"pitch":"A2","lyric":"dem"},{"at":960,"duration":720,"pitch":"G2","lyric":"him-"},{"at":1680,"duration":240,"pitch":"A2","lyric":"me-"}]}},{"id":"m10","number":"10","section":"lied","meter":[3,2],"keyFifths":0,"voices":{"s1":[{"at":0,"duration":480,"pitch":"B4","lyric":"li-"},{"at":480,"duration":480,"pitch":"A4","lyric":"schen"},{"at":960,"duration":1920,"pitch":"G4","lyric":"Heer."}],"s2":[{"at":0,"duration":480,"pitch":"D4","lyric":"li-"},{"at":480,"duration":480,"pitch":"D4","lyric":"schen"},{"at":960,"duration":1920,"pitch":"D4","lyric":"Heer."}],"t1":[{"at":0,"duration":240,"pitch":"A3"},{"at":240,"duration":480,"pitch":"G3"},{"at":720,"duration":240,"pitch":"F#3","lyric":"schen"},{"at":960,"duration":1920,"pitch":"G3","lyric":"Heer."}],"t2":[{"at":0,"duration":360,"pitch":"B2","lyric":"li-"},{"at":360,"duration":120,"pitch":"C3"},{"at":480,"duration":480,"pitch":"D3","lyric":"schen"},{"at":960,"duration":1920,"pitch":"G2","lyric":"Heer."}]},"barlines":[{"at":1920,"kind":"final"}]}]}