{"format":"chorprobe/v1","title":"Mein Seel soll loben Gott den Herrn, SWV 251","subtitle":"SATB · CPDL #46653","composer":"Heinrich Schütz · Text: Cornelius Becker · Ausgabe: James Gibb","tempo":80,"ppq":480,"source":{"description":"Automatisch umgewandelt aus der MusicXML-Datei „Psalm_146_Becker_Schutz.mxl“ der CPDL-Seite „Mein Seel soll loben Gott den Herrn, SWV 251 (Heinrich Schütz)“ mit tools/liedquellen/cpdl_import.py. Nicht gegen die Vorlage geprüft. Hinweis der Ausgabe: Transcribed from the Blankenburg edition on IMSLP.","copyright":"Ausgabe: © James Gibb, Choral Public Domain Library (CPDL #46653, https://www.cpdl.org/wiki/index.php/Mein_Seel_soll_loben_Gott_den_Herrn%2C_SWV_251_%28Heinrich_Sch%C3%BCtz%29). Lizenz: CPDL-Lizenz (ChoralWiki Public Domain License, https://www.cpdl.org/wiki/index.php/ChoralWiki:CPDL). Geändert am 2026-10-04: in das Format chorprobe/v1 umgewandelt (Chorprobe-Import). Diese Datei darf unter denselben Bedingungen weitergegeben werden.","edition":"Ausgabe James Gibb (2017-10-07), CPDL #46653."},"voices":[{"id":"s1","name":"Sopran I","short":"S1","clef":"treble"},{"id":"s2","name":"Sopran II","short":"S2","clef":"treble"},{"id":"t1","name":"Tenor I","short":"T1","clef":"treble"},{"id":"t2","name":"Tenor II","short":"T2","clef":"bass"}],"sections":[{"id":"lied","name":"Lied"}],"measures":[{"id":"m1","number":"1","section":"lied","meter":[2,2],"keyFifths":2,"voices":{"s1":[{"at":0,"duration":960,"pitch":"F#4","lyric":"Mein"},{"at":960,"duration":480,"pitch":"A4","lyric":"Seel"},{"at":1440,"duration":480,"pitch":"A4","lyric":"soll"}],"s2":[{"at":0,"duration":960,"pitch":"D4","lyric":"Mein"},{"at":960,"duration":480,"pitch":"C#4","lyric":"Seel"},{"at":1440,"duration":480,"pitch":"F#4","lyric":"soll"}],"t1":[{"at":0,"duration":960,"pitch":"B3","lyric":"Mein"},{"at":960,"duration":480,"pitch":"A3","lyric":"Seel"},{"at":1440,"duration":480,"pitch":"D4","lyric":"soll"}],"t2":[{"at":0,"duration":960,"pitch":"B2","lyric":"Mein"},{"at":960,"duration":480,"pitch":"F#3","lyric":"Seel"},{"at":1440,"duration":480,"pitch":"D3","lyric":"soll"}]}},{"id":"m2","number":"2","section":"lied","meter":[2,2],"keyFifths":2,"voices":{"s1":[{"at":0,"duration":480,"pitch":"B4","lyric":"lo-"},{"at":480,"duration":480,"pitch":"A4","lyric":"ben"},{"at":960,"duration":480,"pitch":"G4","lyric":"Gott"},{"at":1440,"duration":480,"pitch":"G4","lyric":"den"}],"s2":[{"at":0,"duration":480,"pitch":"D4","lyric":"lo-"},{"at":480,"duration":480,"pitch":"A3","lyric":"ben"},{"at":960,"duration":480,"pitch":"E4","lyric":"Gott"},{"at":1440,"duration":480,"pitch":"E4","lyric":"den"}],"t1":[{"at":0,"duration":480,"pitch":"B3","lyric":"lo-"},{"at":480,"duration":480,"pitch":"D4","lyric":"ben"},{"at":960,"duration":480,"pitch":"D4","lyric":"Gott"},{"at":1440,"duration":480,"pitch":"C#4","lyric":"den"}],"t2":[{"at":0,"duration":480,"pitch":"G3","lyric":"lo-"},{"at":480,"duration":480,"pitch":"F#3","lyric":"ben"},{"at":960,"duration":480,"pitch":"E3","lyric":"Gott"},{"at":1440,"duration":480,"pitch":"E3","lyric":"den"}]}},{"id":"m3","number":"3","section":"lied","meter":[2,2],"keyFifths":2,"voices":{"s1":[{"at":0,"duration":960,"pitch":"F#4","lyric":"Herrn,"},{"at":960,"duration":960,"pitch":"A4","lyric":"ich"}],"s2":[{"at":0,"duration":960,"pitch":"A3","lyric":"Herrn,"},{"at":960,"duration":960,"pitch":"F#4","lyric":"ich"}],"t1":[{"at":0,"duration":960,"pitch":"D4","lyric":"Herrn,"},{"at":960,"duration":960,"pitch":"D4","lyric":"ich"}],"t2":[{"at":0,"duration":960,"pitch":"D3","lyric":"Herrn,"},{"at":960,"duration":960,"pitch":"D3","lyric":"ich"}]}},{"id":"m4","number":"4","section":"lied","meter":[2,2],"keyFifths":2,"voices":{"s1":[{"at":0,"duration":480,"pitch":"B4","lyric":"lob"},{"at":480,"duration":480,"pitch":"C#5","lyric":"ihn"},{"at":960,"duration":480,"pitch":"D5","lyric":"ja"},{"at":1440,"duration":480,"pitch":"E5","lyric":"von"}],"s2":[{"at":0,"duration":480,"pitch":"F#4","lyric":"lob"},{"at":480,"duration":480,"pitch":"A4","lyric":"ihn"},{"at":960,"duration":480,"pitch":"A4","lyric":"ja"},{"at":1440,"duration":480,"pitch":"A4","lyric":"von"}],"t1":[{"at":0,"duration":480,"pitch":"D4","lyric":"lob"},{"at":480,"duration":480,"pitch":"E4","lyric":"ihn"},{"at":960,"duration":480,"pitch":"F#4","lyric":"ja"},{"at":1440,"duration":480,"pitch":"E4","lyric":"von"}],"t2":[{"at":0,"duration":480,"pitch":"B2","lyric":"lob"},{"at":480,"duration":480,"pitch":"A2","lyric":"ihn"},{"at":960,"duration":480,"pitch":"D3","lyric":"ja"},{"at":1440,"duration":480,"pitch":"C#3","lyric":"von"}]}},{"id":"m5","number":"5","section":"lied","meter":[2,2],"keyFifths":2,"voices":{"s1":[{"at":0,"duration":240,"pitch":"D5","lyric":"Her-"},{"at":240,"duration":240,"pitch":"C#5"},{"at":480,"duration":480,"pitch":"B4","lyric":"zen"},{"at":960,"duration":960,"pitch":"A4","lyric":"gern,"}],"s2":[{"at":0,"duration":240,"pitch":"F#4","lyric":"Her-"},{"at":240,"duration":240,"pitch":"A4"},{"at":480,"duration":480,"pitch":"G#4","lyric":"zen"},{"at":960,"duration":960,"pitch":"A4","lyric":"gern,"}],"t1":[{"at":0,"duration":240,"pitch":"A3","lyric":"Her-"},{"at":240,"duration":240,"pitch":"E4"},{"at":480,"duration":480,"pitch":"E4","lyric":"zen"},{"at":960,"duration":960,"pitch":"C#4","lyric":"gern,"}],"t2":[{"at":0,"duration":240,"pitch":"D3","lyric":"Her-"},{"at":240,"duration":240,"pitch":"A2"},{"at":480,"duration":480,"pitch":"E3","lyric":"zen"},{"at":960,"duration":960,"pitch":"A2","lyric":"gern,"}]}},{"id":"m6","number":"6","section":"lied","meter":[2,2],"keyFifths":2,"voices":{"s1":[{"at":0,"duration":960,"pitch":"D5","lyric":"ich"},{"at":960,"duration":480,"pitch":"C#5","lyric":"will"},{"at":1440,"duration":480,"pitch":"E5","lyric":"lob-"}],"s2":[{"at":0,"duration":960,"pitch":"F#4","lyric":"ich"},{"at":960,"duration":480,"pitch":"F#4","lyric":"will"},{"at":1440,"duration":480,"pitch":"E4","lyric":"lob-"}],"t1":[{"at":0,"duration":960,"pitch":"B3","lyric":"ich"},{"at":960,"duration":480,"pitch":"A3","lyric":"will"},{"at":1440,"duration":480,"pitch":"A3","lyric":"lob-"}],"t2":[{"at":0,"duration":960,"pitch":"B2","lyric":"ich"},{"at":960,"duration":480,"pitch":"F#3","lyric":"will"},{"at":1440,"duration":480,"pitch":"C#3","lyric":"lob-"}]}},{"id":"m7","number":"7","section":"lied","meter":[2,2],"keyFifths":2,"voices":{"s1":[{"at":0,"duration":480,"pitch":"B4","lyric":"sin-"},{"at":480,"duration":480,"pitch":"G4","lyric":"gen"},{"at":960,"duration":480,"pitch":"B4","lyric":"mei-"},{"at":1440,"duration":480,"pitch":"C#5","lyric":"nem"}],"s2":[{"at":0,"duration":480,"pitch":"E4","lyric":"sin-"},{"at":480,"duration":480,"pitch":"E4","lyric":"gen"},{"at":960,"duration":480,"pitch":"D4","lyric":"mei-"},{"at":1440,"duration":480,"pitch":"A4","lyric":"nem"}],"t1":[{"at":0,"duration":480,"pitch":"G3","lyric":"sin-"},{"at":480,"duration":480,"pitch":"B3","lyric":"gen"},{"at":960,"duration":480,"pitch":"B3","lyric":"mei-"},{"at":1440,"duration":480,"pitch":"E4","lyric":"nem"}],"t2":[{"at":0,"duration":480,"pitch":"E3","lyric":"sin-"},{"at":480,"duration":480,"pitch":"E3","lyric":"gen"},{"at":960,"duration":240,"pitch":"G3","lyric":"mei-"},{"at":1200,"duration":240,"pitch":"B3"},{"at":1440,"duration":480,"pitch":"A3","lyric":"nem"}]}},{"id":"m8","number":"8","section":"lied","meter":[2,2],"keyFifths":2,"voices":{"s1":[{"at":0,"duration":960,"pitch":"D5","lyric":"Gott,"},{"at":960,"duration":960,"pitch":"A4","lyric":"so"}],"s2":[{"at":0,"duration":960,"pitch":"A4","lyric":"Gott,"},{"at":960,"duration":960,"pitch":"F#4","lyric":"so"}],"t1":[{"at":0,"duration":960,"pitch":"F#4","lyric":"Gott,"},{"at":960,"duration":960,"pitch":"D4","lyric":"so"}],"t2":[{"at":0,"duration":960,"pitch":"D3","lyric":"Gott,"},{"at":960,"duration":960,"pitch":"D3","lyric":"so"}]}},{"id":"m9","number":"9","section":"lied","meter":[2,2],"keyFifths":2,"voices":{"s1":[{"at":0,"duration":480,"pitch":"C#5","lyric":"lang"},{"at":480,"duration":480,"pitch":"D5","lyric":"ich"},{"at":960,"duration":480,"pitch":"E5","lyric":"leb"},{"at":1440,"duration":480,"pitch":"D5","lyric":"bis"}],"s2":[{"at":0,"duration":480,"pitch":"A4","lyric":"lang"},{"at":480,"duration":480,"pitch":"A4","lyric":"ich"},{"at":960,"duration":480,"pitch":"G4","lyric":"leb"},{"at":1440,"duration":480,"pitch":"F#4","lyric":"bis"}],"t1":[{"at":0,"duration":480,"pitch":"E4","lyric":"lang"},{"at":480,"duration":480,"pitch":"F#4","lyric":"ich"},{"at":960,"duration":480,"pitch":"B3","lyric":"leb"},{"at":1440,"duration":480,"pitch":"D4","lyric":"bis"}],"t2":[{"at":0,"duration":480,"pitch":"A3","lyric":"lang"},{"at":480,"duration":480,"pitch":"F#3","lyric":"ich"},{"at":960,"duration":480,"pitch":"E3","lyric":"leb"},{"at":1440,"duration":480,"pitch":"B3","lyric":"bis"}]}},{"id":"m10","number":"10","section":"lied","meter":[2,2],"keyFifths":2,"voices":{"s1":[{"at":0,"duration":480,"pitch":"C#5","lyric":"in"},{"at":480,"duration":960,"pitch":"B4"},{"at":1440,"duration":480,"pitch":"A#4","lyric":"den"}],"s2":[{"at":0,"duration":960,"pitch":"G4","lyric":"in"},{"at":960,"duration":960,"pitch":"F#4"}],"t1":[{"at":0,"duration":720,"pitch":"E4","lyric":"in"},{"at":720,"duration":240,"pitch":"D4"},{"at":960,"duration":480,"pitch":"C#4"},{"at":1440,"duration":480,"pitch":"C#4","lyric":"den"}],"t2":[{"at":0,"duration":960,"pitch":"E3","lyric":"in"},{"at":960,"duration":960,"pitch":"F#3"}]}},{"id":"m11","number":"11","section":"lied","meter":[2,2],"keyFifths":2,"voices":{"s1":[{"at":0,"duration":1920,"pitch":"B4","lyric":"Tod."}],"s2":[{"at":0,"duration":1920,"pitch":"F#4","lyric":"Tod."}],"t1":[{"at":0,"duration":1920,"pitch":"B3","lyric":"Tod."}],"t2":[{"at":0,"duration":1920,"pitch":"B2","lyric":"Tod."}]},"barlines":[{"at":1920,"kind":"final"}]}]}